1|Arsenic|13678|Arsenic is a semi-metal element in the periodic table. It is odorless and tasteless. It enters drinking water supplies from natural deposits in the earth or from agricultural and industrial practices. Non-cancer effects can include thickening and discoloration of the skin, stomach pain, nausea, vomiting; diarrhea; numbness in hands and feet; partial paralysis; and blindness. Arsenic has been linked to cancer of the bladder, lungs, skin, kidney, nasal passages, liver, and prostate.||1.00||
2|Earthquake prone area|13679|Building in an earthquake prone area is a structural hazard.||2.00||
3|Floodplain|13680|Building in a floodplain is a structural hazard.||3.00||
4|Liquefaction, landslide areas|13681|Building in a landslide area is a structural hazard.||4.00||
5|Naturally Occurring Asbestos (NOA)|13682|Naturally occurring asbestos (NOA) includes fibrous minerals found in certain types of rock formations. NOA can take the form of long, thin, separable fibers. Natural weathering or human disturbance can break NOA down to microscopic fibers, easily suspended in air. There is no health threat if NOA remains undisturbed and does not become airborne.||5.00||
6|Sinkholes, Karst terrain|13683|Building in a sinkhole is a structural hazard.||6.00||
